[
  {
    "scenarioVersion": "1.0.0",
    "id": "STATIC-100K",
    "population": 100000,
    "visibilityPercent": 100,
    "width": 1920,
    "height": 1080,
    "renderScale": 1,
    "durationSeconds": 20,
    "warmupSeconds": 5,
    "seed": 1511508451,
    "fixedTimestepSeconds": 0.016666666666666666,
    "cameraPath": "default-orbit-static-v1",
    "input": "disabled",
    "lodMode": "near-only",
    "workgroupSize": 128
  },
  {
    "scenarioVersion": "1.0.0",
    "id": "SIM-250K",
    "population": 250000,
    "visibilityPercent": 100,
    "width": 1920,
    "height": 1080,
    "renderScale": 1,
    "durationSeconds": 20,
    "warmupSeconds": 5,
    "seed": 1511508451,
    "fixedTimestepSeconds": 0.016666666666666666,
    "cameraPath": "default-orbit-static-v1",
    "input": "disabled",
    "lodMode": "near-only",
    "workgroupSize": 128
  },
  {
    "scenarioVersion": "1.0.0",
    "id": "CULL-1M-10",
    "population": 1000000,
    "visibilityPercent": 10,
    "width": 1920,
    "height": 1080,
    "renderScale": 1,
    "durationSeconds": 20,
    "warmupSeconds": 5,
    "seed": 1511508451,
    "fixedTimestepSeconds": 0.016666666666666666,
    "cameraPath": "default-orbit-static-v1",
    "input": "disabled",
    "lodMode": "auto",
    "workgroupSize": 128
  },
  {
    "scenarioVersion": "1.0.0",
    "id": "CULL-1M-100",
    "population": 1000000,
    "visibilityPercent": 100,
    "width": 1920,
    "height": 1080,
    "renderScale": 1,
    "durationSeconds": 20,
    "warmupSeconds": 5,
    "seed": 1511508451,
    "fixedTimestepSeconds": 0.016666666666666666,
    "cameraPath": "default-orbit-static-v1",
    "input": "disabled",
    "lodMode": "auto",
    "workgroupSize": 128
  },
  {
    "scenarioVersion": "1.0.0",
    "id": "LOD-500K",
    "population": 500000,
    "visibilityPercent": 100,
    "width": 1920,
    "height": 1080,
    "renderScale": 1,
    "durationSeconds": 20,
    "warmupSeconds": 5,
    "seed": 1511508451,
    "fixedTimestepSeconds": 0.016666666666666666,
    "cameraPath": "default-orbit-static-v1",
    "input": "disabled",
    "lodMode": "auto",
    "workgroupSize": 128
  },
  {
    "scenarioVersion": "1.0.0",
    "id": "SCALE-500K-720",
    "population": 500000,
    "visibilityPercent": 100,
    "width": 1280,
    "height": 720,
    "renderScale": 1,
    "durationSeconds": 20,
    "warmupSeconds": 5,
    "seed": 1511508451,
    "fixedTimestepSeconds": 0.016666666666666666,
    "cameraPath": "default-orbit-static-v1",
    "input": "disabled",
    "lodMode": "auto",
    "workgroupSize": 128
  },
  {
    "scenarioVersion": "1.0.0",
    "id": "SCALE-500K-50",
    "population": 500000,
    "visibilityPercent": 100,
    "width": 1920,
    "height": 1080,
    "renderScale": 0.5,
    "durationSeconds": 20,
    "warmupSeconds": 5,
    "seed": 1511508451,
    "fixedTimestepSeconds": 0.016666666666666666,
    "cameraPath": "default-orbit-static-v1",
    "input": "disabled",
    "lodMode": "auto",
    "workgroupSize": 128
  },
  {
    "scenarioVersion": "1.0.0",
    "id": "LOD-500K-WG256",
    "population": 500000,
    "visibilityPercent": 100,
    "width": 1920,
    "height": 1080,
    "renderScale": 1,
    "durationSeconds": 20,
    "warmupSeconds": 5,
    "seed": 1511508451,
    "fixedTimestepSeconds": 0.016666666666666666,
    "cameraPath": "default-orbit-static-v1",
    "input": "disabled",
    "lodMode": "auto",
    "workgroupSize": 256
  }
]
